{
    "$schema": "http://json-schema.org/draft-07/schema#",
    "type": "object",
    "properties": {
        "name": {
            "type": "string",
            "description": "The name of the report."
        },
        "dateCreated": {
            "type": "string",
            "pattern": "^\\d{4}-\\d{2}-\\d{2}$",
            "description": "The date when the report was created (YYYY-MM-DD)."
        },
        "timeCreated": {
            "type": "string",
            "pattern": "^\\d{2}:\\d{2}:\\d{2}$",
            "description": "The time when the report was created (HH:MM:SS)."
        },
        "version": {
            "type": "integer",
            "description": "The version of the report."
        },
        "author": {
            "type": "string",
            "description": "The author of the report."
        },
        "questions": {
            "type": "array",
            "description": "The list of questions in the report.",
            "items": {
                "type": "object",
                "properties": {
                    "text": {
                        "type": "string",
                        "description": "The text of the question."
                    },
                    "answer": {
                        "anyOf": [
                            {
                                "type": "string",
                                "description": "The answer to the question."
                            },
                            {
                                "type": "null",
                                "description": "No answer provided."
                            }
                        ]
                    },
                    "principle":{
                        "type": "string",
                        "description": "The GDPR principle that the question relates to."
                    },
                    "explanation":{
                        "anyOf": [
                            {
                                "type": "string",
                                "description": "The explanation included with the answer"
                            },
                            {
                                "type": "null",
                                "description": "No explanation provided."
                            }
                        ]
                    }
                },
                "required": ["text", "answer", "principle"]
            }
        }
    },
    "required": ["name", "dateCreated", "timeCreated", "version", "author", "questions"]
}
