{
  "name": "Compliance Report for Bosch Smart cameras",
  "dateCreated": "2024-04-23",
  "timeCreated": "15:04:34",
  "version": 1,
  "author": "Jakub",
  "questions": [
    {
        "text": "Does the privacy policy clearly identify the data controller and provide contact details?",
        "answer": "Yes, the data controller is clearly identified with full contact details.",
        "principle": "Transparency",
        "score": 3,
        "explanation": ""
    },
    {
        "text": "Is the purpose of data processing clearly stated and justified within the policy?",
        "answer": "Yes, the purpose is clearly stated, justified, and aligned with GDPR requirements.",
        "principle": "Purpose Limitation",
        "score": 3,
        "explanation": ""
    },
    {
        "text": "Are the specific purposes for processing personal data clearly defined and limited?",
        "answer": "Yes, specific purposes are clearly defined and limited as per GDPR.",
        "principle": "Purpose Limitation",
        "score": 3,
        "explanation": ""
    },
    {
        "text": "Is there a clear explanation of how collecting personal data serves these purposes?",
        "answer": "Yes, there is a clear explanation of how data collection serves the purposes.",
        "principle": "Transparency",
        "score": 3,
        "explanation": ""
    },
    {
        "text": "Does the policy ensure that only the necessary personal data for the specified purposes are collected and processed?",
        "answer": "Yes, the policy ensures only necessary data for specified purposes are collected.",
        "principle": "Data Minimization",
        "score": 3,
        "explanation": ""
    },
    {
        "text": "Are there mechanisms in place to ensure that personal data is kept accurate and up-to-date?",
        "answer": "Yes, there are clear mechanisms to keep data accurate and up-to-date.",
        "principle": "Accuracy",
        "score": 3,
        "explanation": ""
    },
    {
        "text": "Does the policy specify the retention period for personal data?",
        "answer": "Yes, the retention period is specified and limited to necessary purposes.",
        "principle": "Storage Limitation",
        "score": 3,
        "explanation": ""
    },
    {
        "text": "What security measures are described to protect personal data against unauthorized or unlawful processing and against accidental loss, destruction, or damage?",
        "answer": "Yes, comprehensive security measures are described.",
        "principle": "Security",
        "score": 3,
        "explanation": ""
    },
    {
        "text": "Does the policy clearly outline the rights of data subjects, including the right to access, correct, delete, or restrict the processing of their personal data?",
        "answer": "Yes, the rights are clearly outlined and the process to exercise them is accessible.",
        "principle": "Rights of Data Subjects",
        "score": 3,
        "explanation": ""
    },
    {
        "text": "Does the policy address the use of automated decision-making and profiling, and if so, does it explain the logic involved and its significance and consequences for the data subject?",
        "answer": "Yes, it's clearly addressed with detailed explanations of the logic and significance.",
        "principle": "Automated Decision-Making and Profiling",
        "score": 3,
        "explanation": ""
    },
    {
        "text": "If the smart cameras use facial recognition or other biometric profiling, how is this addressed in the policy? Are individuals informed about the use of such technologies?",
        "answer": "Yes, the use is clearly addressed, with detailed policies and individual notifications.",
        "principle": "Special Categories of Data",
        "score": 3,
        "explanation": ""
    },
    {
        "text": "How does the policy address the issue of consent for collecting data through smart cameras, particularly in areas where individuals may not have a choice in being observed?",
        "answer": "Yes, the policy clearly addresses consent with a clear withdrawal process.",
        "principle": "Consent",
        "score": 3,
        "explanation": ""
    },
    {
        "text": "Is there a clear procedure for notifying the supervisory authority and affected data subjects in case of a data breach?",
        "answer": "Yes, there is a clear procedure for notification of breaches.",
        "principle": "Accountability",
        "score": 3,
        "explanation": ""
    },
    {
        "text": "If a Data Protection Officer is required, does the policy provide details about the DPO, including contact information?",
        "answer": "Yes, the DPO is clearly detailed with contact information.",
        "principle": "Data Protection Officer",
        "score": 3,
        "explanation": ""
    }
]
}
